MediaItemID,Item ID,Media Outlet,Media Item Type,Headline,Date,wordCount,state,country,Full Text,Summary,Page Number,WebURL,briefId,briefName,AirDate,council_mentions_answer,council_mentions_relevance,council_mentions_reason,council_mentions_relevant_text,other_news_answer,other_news_relevance,other_news_reason,other_news_relevant_text,auto_summary,story_id,story_title,story_summary,Sub_Cluster_ID,Sub_Cluster_Title,Sub_Cluster_Summary,Item_Type,Is_Lead,Lead_Article_ID,Rank,Score,Ordering_Section,Ordering_Reason,Ordering_Relevant_Text
,1169976873,MyCityLogan,Newspaper,Haye your say on park plans,2026-02-10T07:13:00.290Z,,,,"
    SHAILER Park residents are encouraged to provide feedback to Logan City Council on proposed upgrades to Adelong Park.

    The draft plan is to remove the existing playround equipment and replace it with a large play structure with slides, a climbing net, a swing set with an inclusive basket swing and spring rockers for younger children.

    The existing basketball court will be refreshed with new line marking, a backboard and net.

    New bench seats and footpath connections are also planned, while the park's existing shelters with seating and bin will remain.

    Residents can provide feedback until Tuesday 10 February.","SHAILER Park residents are encouraged to provide feedback to Logan City Council on proposed upgrades to Adelong Park. The draft plan is to remove the existing playround equipment and replace it with a large play structure with slides, a climbing net, a swing set with an inclusive basket swing and spring rockers for younger children.",3,,,,,yes,Low,"The article is a call for community feedback on a park upgrade issued by Logan City Council, which is the core focus of the section. However, it does not mention individual councilors or the Mayor, nor is it from a TV news bulletin, which are prioritized criteria. It aligns with the note about the client valuing MyCityLogan (the likely source).",SHAILER Park residents are encouraged to provide feedback to Logan City Council on proposed upgrades to Adelong Park.,no,Medium,"The article discusses proposed upgrades to a public park in the Logan region, which is a form of local community infrastructure. While it does not directly address the more specific or contentious community issues listed in the criteria (e.g., safety, law enforcement), it is relevant as a community and public infrastructure matter within Logan.",SHAILER Park residents are encouraged to provide feedback to Logan City Council on proposed upgrades to Adelong Park.,"Logan City Council is seeking feedback from Shailer Park residents on proposed upgrades to Adelong Park. The draft plan includes replacing the existing playground with a large new play structure featuring slides, a climbing net, an inclusive swing set, and spring rockers, as well as refreshing the basketball court and adding new bench seats and footpaths. Residents can provide their input on the project to the council until Tuesday, February 10th.",logan_council_planning_services,Logan Council Advances City Plan and Community Projects,"Logan City Council is progressing several key initiatives. The draft Logan Plan is moving forward after receiving over 4000 community submissions, with a focus on refining flood risk policy and launching a public survey in March 2026. In Shailer Park, the council is seeking resident feedback on a proposed upgrade to Adelong Park, which includes a large new playground and refreshed facilities. The council also awarded $5000 Tertiary Educational Bursaries to ten local high school graduates, including Mitchell Dixon from Canterbury College, to help cover the costs of starting university.",,,,Lead,True,1169976873,1.0,0.82,COUNCIL MENTIONS,Ranked highest due to its top-priority Print media type combined with the most prominent placement on page 3. The article positively features a direct council initiative.,SHAILER Park residents are encouraged to provide feedback to Logan City Council on proposed upgrades to Adelong Park.
,1169976899,MyCityLogan,Newspaper,Bench sparks conversation,2026-02-10T07:13:00.290Z,,,,"
    A BRIGHT yellow community bench has been installed at Boronia Bushland Reserve to help spread awareness about the impact of domestic and family violence.

    The seat has been installed in remembrance of Brisbane woman Allison Baden-Clay, who was killed by her husband in 2012.

    The orange and yellow bench features sunflowers, which were Ms Baden-Clay's favourite flower, and symbolise kindness and hope.

    Logan Division 7 councillor Tim Frazer said the council hoped the bench would prompt conversations about domestic and family VIO lence in our communities. The bench is one of several installed across Logan to raise awarness of domestic violence.

    Others are at Middle Park, Forest Glen Park, Silvertop Park, Sweetgum Park and outside the Logan West Community Centre.

    The bench was unveiled by Vanessa Fowler from the Allison Baden-Clay Foundation with Cr Frazer and Member for Waterford Shannon Fentiman.

Caption Text:
Vanessa Fowler (pictured centre) with Cr Tim Frazer andMF Shannon Fentiman.","A BRIGHT yellow community bench has been installed at Boronia Bushland Reserve to help spread awareness about the impact of domestic and family violence. The seat has been installed in remembrance of Brisbane woman Allison Baden-Clay, who was killed by her husband in 2012.",5,,,,,yes,High,The article directly mentions Logan City Council and a Logan councillor (Cr Tim Frazer) discussing a council initiative to raise awareness about domestic violence.,Logan Division 7 councillor Tim Frazer said the council hoped the bench would prompt conversations about domestic and family violence in our communities. The bench is one of several installed across Logan to raise awareness of domestic violence.,no,Medium,"The article discusses a community safety initiative (a memorial bench to raise awareness about domestic violence) installed in the Logan region, specifically at Boronia Bushland Reserve and several other Logan locations. This directly relates to 'community safety' and local issues within the Logan area.",A BRIGHT yellow community bench has been installed at Boronia Bushland Reserve... Logan Division 7 councillor Tim Frazer said the council hoped the bench would prompt conversations about domestic and family violence in our communities. The bench is one of several installed across Logan...,"A bright yellow community bench, adorned with sunflowers, has been installed at Boronia Bushland Reserve in Logan to raise awareness about domestic and family violence, in memory of Brisbane woman Allison Baden-Clay who was killed in 2012. The bench was unveiled by Vanessa Fowler from the Allison Baden-Clay Foundation, alongside Logan Division 7 councillor Tim Frazer and Member for Waterford Shannon Fentiman. Councillor Frazer stated the council hopes the bench, one of several installed across Logan, will prompt important community conversations about the issue.",logan_community_initiatives,Logan Community Groups Foster Support and Connection,"Several community-focused initiatives are underway across Logan. A bright yellow community bench was unveiled at Boronia Bushland Reserve to raise awareness of domestic and family violence, in memory of Allison Baden-Clay. The City Women Logan forum, hosted by Impact Care Service, will feature keynote speaker Karen Muras, a domestic violence survivor who now builds tiny homes for women in need. For seniors, the new Logan Village Probus Club has seen rapid growth to 120 members since its start in October 2024. Additionally, the Logan Youth Action Group is recruiting young people aged 14-24 to get involved in local projects and workshops.",,,,Lead,True,1169976899,2.0,0.79,COUNCIL MENTIONS,Ranked second due to being a high-priority Print media type with a strong placement on page 5. The article highlights positive council action on community awareness for domestic violence.,Logan Division 7 councillor Tim Frazer said the council hoped the bench would prompt conversations about domestic and family VIO lence in our communities.
,1170196957,MyCityLogan,Newspaper,Grant helps uni students get started,2026-02-10T20:12:00.930Z,,,,"
    LOGAN City Council has given 10 recent high school graduates $5000 grants to put towards their university study.

    Canterbury College graduate Mitchell Dixon will use his grant to study a combined Bachelor of Engineering/Master of Engineering at the University of Queensland's St Lucia campus.

    ""I decided at the start of year 11 that I wanted to do engineering because I liked physics and maths,"" Mr Dixon said.

    ""I ended up having to do biology in Year 12, and that made me realise I want to do something in the health industry.

    ""I found out that I could specialise in mechanical and then major in biomedical engineering, to create robotic equipment that will help people.""

    Mr Dixon, who lives in New Beith and will turn 18 next month, said he was excited to start his coursework and participate in university life.

    ""I'm excited to see my friends and make some new ones and I*1l also partake in some of the ensembles they have there,"" he said.

    A few of Mr Dixon's friends will also be studying a Bachelor of Engineering at The University of Queensland this year, but may specialise in other areas, he said.

    ""I'm going to use the bursary for uni resources like textbooks and stationery, so it will just help me stress less about having to work as much to be able to afford everything ""I honestly had no clue what my chances were of getting the bursary, so it was a nice surprise,"" Mayor Jon Raven said the City of Logan Tertiary Educational Bursaries program helped local students pay for resources like textbooks and technology.

    ""When you walk out of the school gates for the last time, there's a lot of uncertainty about what the future might bring,"" Cr Raven said.

    ""We're proud to get behind those who've enrolled in a degree with some financial support.

    ""It's important they start out on the right foot with things like textbooks and technology, so they can focus on what really matters.""

Caption Text:
Councillor Paul Jackson with Mitchell Dixon and bursary sponsors.",LOGAN City Council has given 10 recent high school graduates $5000 grants to put towards their university study. Canterbury College graduate Mitchell Dixon will use his grant to study a combined Bachelor of Engineering/Master of Engineering at the University of Queensland's St Lucia campus.,6,,,,,yes,High,"The article directly and primarily reports on Logan City Council's Tertiary Educational Bursaries program, includes multiple quotes from Mayor Jon Raven, and features the story of a local grant recipient.","""LOGAN City Council has given 10 recent high school graduates $5000 grants to put towards their university study."" ""Mayor Jon Raven said the City of Logan Tertiary Educational Bursaries program helped local students pay for resources like textbooks and technology.""",no,Low,"The article focuses on a grant program for university students, which is a positive community investment but does not address any of the specific Logan region issues listed in the section criteria (e.g., infrastructure, community safety, local problems).",LOGAN City Council has given 10 recent high school graduates $5000 grants to put towards their university study,"Logan City Council, through its Tertiary Educational Bursaries program, has awarded $5000 grants to ten recent high school graduates, including Canterbury College graduate Mitchell Dixon. Dixon, who will study a combined engineering degree at the University of Queensland, plans to use the bursary for textbooks and stationery, easing his financial burden. Mayor Jon Raven emphasized the program's role in helping local students start their university studies on the right foot by covering essential resources.",logan_council_planning_services,Logan Council Advances City Plan and Community Projects,"Logan City Council is progressing several key initiatives. The draft Logan Plan is moving forward after receiving over 4000 community submissions, with a focus on refining flood risk policy and launching a public survey in March 2026. In Shailer Park, the council is seeking resident feedback on a proposed upgrade to Adelong Park, which includes a large new playground and refreshed facilities. The council also awarded $5000 Tertiary Educational Bursaries to ten local high school graduates, including Mitchell Dixon from Canterbury College, to help cover the costs of starting university.",,,,Lead,True,1170196957,3.0,0.78,COUNCIL MENTIONS,"This ranks third as a high-priority Print article with a solid page 6 placement. The content is highly positive, showcasing council's support for local students.",Mayor Jon Raven said the City of Logan Tertiary Educational Bursaries program helped local students pay for resources like textbooks and technology.
,1170196959,MyCityLogan,Newspaper,Angry parents call to pause development,2026-02-10T20:12:00.930Z,,,,"
    RESIDENTS are fed up roads and infrastrucure they say aren't adequate to handle development, with school zones being some of the worst for traffic jams.

    New Beith resident Bonnie MacRae already has 1400 signatures on a petition to ""pause development"" in her area, in a bid to reach the ""heart of the decision makers"" to create a better plan for traffic flow.

    ""Our communities are growing rapidly, but the infrastructure hasn't kept pace,"" she said.

    ""We are witnessing an influx of new hous ing estates, yet the planning, transport and education departments haven't addressed the critical needs of existing residents,"" ""This petition is intended to raise concern with the local and state bodies that approve the developments in the immediate region, to the community impact and risks associated with such large-scale developments, relating to safety and infrastructure demand.""

    Ms MacRae said school zones were some of the worst areas affected with drivers taking unnecessary and dangerous risks to pass traffic jams.

    ""The ever-expanding traffic and insufficient public transport options have left our roads congested and our children stranded, sometimes waiting for buses that simply cant make it through the traffic on time,"" 9: she said.

    ""Without immediate action to improve and expand the roadways, the safety of our chil dren and all residents is at risk.

    Ms MacRae said a pause on development would allow time for a comprehensive review of existing plans.

    ""This pause will give us time to develop robust infrastructure, including expanding public transport systems and road networks, aligned with the needs of our growing communities,"" she said.

    Mayor Jon Raven said the Queensland Government, through the Department of Education, was responsible for managing school safety.

    ""We know that planning for schools lags growth, which puts pressure on roads that were never designed for that kind of facility and often means there is never enough parking for parents,"" he said.

    ""As part of council's city-wide Parking Enforcement Plan 2023-2026, council aims to help make school drop-off and pick-up times smoother and safer for local families through education and enforcement of parking regulation.""

    Jimboomba mum Beck Capuzzo said all levels of government needed to stop playing the blame game.

    ""They keep building and approving all these new estates but there are no new roads to get around, and every new house has a minimum of two to three cars, so what used to be 100 cars on the road has double or tripled,"" she said.

    ""Something needs to be done."" MyCityLogan contacted The Department of Education for comment.

    Mayor Jon Raven said ""funding constraints limit what and when council can deliver"" when it comes to new infrastructure.

    ""We're the fastest growing city in the state, with around 12,000 new residents choosing to move to Logan every year,"" he said ""We're also home to two Queensland Government Priority Development Areas at Yar rabilba and Flagstone, which are exclusively approved and managed by Economic Development Queensland.""

    Cr Raven said the council was obliged to support the State's priority areas with out-ofsequence infrastructure.

    ""Building this infrastructure means we have less funding available to support the growth in areas like Park Ridge and Logan Reserve which also want to see improvements to their road networks, he said.

    He said this was an ""example of why the council should be solely responsible for planning development across the entire city,"" Ms MacRae's 'Change' petition has received over 1400 signatures and she hopes government will listen.

    Transport and Main Roads, and the Department of Education were contacted for comment but had not responded at the time of publication.

    Comment at mycitylogan.com.au","RESIDENTS are fed up roads and infrastrucure they say aren't adequate to handle development, with school zones being some of the worst for traffic jams. New Beith resident Bonnie MacRae already has 1400 signatures on a petition to ""pause development"" in her area, in a bid to reach the ""heart of the decision makers"" to create a better plan for traffic flow.",7,,,,,yes,High,"The article directly and repeatedly mentions Logan City Council, Mayor Jon Raven, and council's specific plans, fulfilling the section's criteria for including mentions of Logan City Council and its councillors.","""Mayor Jon Raven said... 'As part of council's city-wide Parking Enforcement Plan 2023-2026, council aims to help make school drop-off and pick-up times smoother...' "", and ""Cr Raven said the council was obliged to support the State's priority areas...""",no,High,"The article focuses on infrastructure and community safety issues in the Logan region, specifically detailing traffic congestion, inadequate road networks, and safety concerns around school zones—all of which fall under the section criteria.","RESIDENTS are fed up roads and infrastrucure they say aren't adequate to handle development, with school zones being some of the worst for traffic jams.","Resident Bonnie MacRae has collected over 1400 signatures on a petition calling for a pause on development in Logan's New Beith area, citing dangerously congested roads and inadequate infrastructure, particularly around school zones, that have not kept pace with rapid population growth. Logan Mayor Jon Raven acknowledged the pressure from growth in state-managed Priority Development Areas like Yarrabilba and Flagstone, but noted that funding constraints limit the council's ability to deliver out-of-sequence infrastructure, leading to congestion in other suburbs. Both MacRae and local mother Beck Capuzzo called for all levels of government—including the Queensland Government's Department of Education and Transport and Main Roads—to take urgent action to address the critical safety and transport needs of existing communities.",logan_development_infrastructure,Logan Residents Protest Over Strained Infrastructure,"Residents in Logan are raising alarms about inadequate infrastructure failing to keep pace with rapid housing development. A petition with over 1400 signatures calls for a halt to development in New Beith, citing dangerously congested roads, particularly around schools. Callers to ABC Radio from Jimboomba and the South Burnett region echoed these concerns, describing dangerous traffic backups and erratic driving near new housing estates. Logan Mayor Jon Raven acknowledged the pressure on services from state-managed Priority Development Areas like Yarrabilba and Flagstone but cited funding constraints as a barrier to delivering necessary upgrades. Residents are calling for urgent action from all levels of government to address critical safety and transport needs.",logan_development_infrastructure,Logan Residents Protest Over Strained Infrastructure,"Residents in Logan are raising alarms about inadequate infrastructure failing to keep pace with rapid housing development. A petition with over 1400 signatures calls for a halt to development in New Beith, citing dangerously congested roads, particularly around schools. Callers to ABC Radio from Jimboomba and the South Burnett region echoed these concerns, describing dangerous traffic backups and erratic driving near new housing estates. Logan Mayor Jon Raven acknowledged the pressure on services from state-managed Priority Development Areas like Yarrabilba and Flagstone but cited funding constraints as a barrier to delivering necessary upgrades. Residents are calling for urgent action from all levels of government to address critical safety and transport needs.",Lead,True,1170196959,4.0,0.77,COUNCIL MENTIONS,"A high-value Print placement, ranked fourth based on its page number (7). It provides a key platform for the Mayor to address resident concerns about development and infrastructure.","Mayor Jon Raven said ""funding constraints limit what and when council can deliver"" when it comes to new infrastructure."
