MediaItemID,Item ID,Media Outlet,Media Item Type,Headline,Date,wordCount,state,country,Full Text,Summary,Page Number,WebURL,briefId,briefName,AirDate,council_mentions_answer,council_mentions_relevance,council_mentions_reason,council_mentions_relevant_text,other_news_answer,other_news_relevance,other_news_reason,other_news_relevant_text,auto_summary,story_id,story_title,story_summary,Sub_Cluster_ID,Sub_Cluster_Title,Sub_Cluster_Summary,Item_Type,Is_Lead,Lead_Article_ID,Rank,Score,Ordering_Section,Ordering_Reason,Ordering_Relevant_Text
,1169975659,MyCityLogan,Newspaper,Cans boost local coffers,2026-02-10T07:07:00.607Z,,,,"
    MORE than 100 million containers have been recycled at Jimboomba's Containers for Change location, generating $10 million for local recyclers.

    The Exchange Shed owner Megan Lever said she was proud of the impact container refunds lodged by local families, community members, charities, groups and schools have had on the community.

    At 10c a container, $10 million has been earned from community recycling efforts at The Exchange Shed, since it opened in 2019.

    ""Seeing how container refunds help us support local causes is pretty amazing it shows the real power of recycling,"" Mrs Lever said.

    ""It's a privilege to give back to the people and groups who support us.""

    In 2021, The Exchange Shed partnered with Rosies Friends on the Street, which supports people experiencing homelessness.

    It donates an estimated $20,000 a year to support Rosies fundraising initiatives.

    Locals can also drop off essential non-perishable food items such as instant cup noodles, biscuits and cordial at The Exchange Shed, which Rosies Friends on the Street distributes across south-east Queensland.

    Rosies _ Friends on the Street head of fundraising Lacee Hennessy Overton said The Exchange enabled her organisation to provide support to the community's most vulnerable.

    ""Every action that Megan and her team take enable us to provide comfort, connection, friendship and referral to people experiencing homelessness, disadvantage and social isolation,"" Mrs Hennessy Overton said.

    ""Our volunteers could not do the work they do every night without the support of generous individuals and business owners like Megan. 939 Container Exchange interim chief executive officer Trevor Evans, whose organisation runs Containers for Change, congratulated the Jimboomba depot for its impressive achievement.

    This milestone reflects the extraordinary difference a single depot can make when it becomes part of the heartbeat of its community,"" Mr Evans said.

Caption Text:
Rosies' Lacee Hennessy Overton with The Exchange Shed owner Megan Lever","MORE than 100 million containers have been recycled at Jimboomba's Containers for Change location, generating $10 million for local recyclers. The Exchange Shed owner Megan Lever said she was proud of the impact container refunds lodged by local families, community members, charities, groups and schools have had on the community.",12,,,,,no,Not relevant,"The article focuses on the success of a container recycling depot in Jimboomba and its partnership with a charity, with no mention of Logan City Council, its councillors, or Mayor-elect Jon Raven.","The article does not contain any text mentioning Logan City Council, its councillors, or Mayor-elect Jon Raven.",yes,Medium,"The article is about a community initiative in Jimboomba (part of the Logan region) that raises funds to address homelessness and support vulnerable people, which falls under the section criteria of discussing homelessness and community issues in Logan.","""In 2021, The Exchange Shed partnered with Rosies Friends on the Street, which supports people experiencing homelessness.""","The Exchange Shed recycling depot in Jimboomba has recycled over 100 million containers since 2019, generating $10 million in refunds for local recyclers. Owner Megan Lever highlighted the community impact, including an annual $20,000 donation to Rosies Friends on the Street, which supports the homeless. 939 Container Exchange interim CEO Trevor Evans praised the depot's achievement and its role as a key part of the local community.",jimboomba_community_business,Jimboomba Businesses Celebrate Community Milestones,"Two local Jimboomba businesses are celebrating significant community contributions. The Exchange Shed recycling depot has processed over 100 million containers since 2019, resulting in $10 million in refunds for the community and significant donations to charities like Rosies Friends on the Street. Meanwhile, Jimboomba Turf, a supplier celebrating over 50 years in business, is hosting a community family day at Flagstone Water Play Park, featuring a free BBQ and entertainment to thank the local community for its support.",,,,Lead,True,1169975659,8.0,0.627,OTHER NEWS,Ranked as a valuable print piece due to the media type priority. The score reflects its page number and positive local focus on recycling in Jimboomba.,"MORE than 100 million containers have been recycled at Jimboomba's Containers for Change location, generating $10 million for local recyclers."
,1170196948,MyCityLogan,Newspaper,Rates rise will not dampen demand for Logan homes,2026-02-10T20:08:00.503Z,,,,"
    LOCAL real estate agents say the increase in mortgage repayment interest rates will have little to no effect on Logan's property market.

    The Reserve Bank of Australia raised interest rates by 0.25% on Tuesday 3 February, due to lingering economic inflation.

    It was the first rate rise since 2023 and the cash rate now sits at 3.85%.

    LJ Hooker estate agent Pragya Ojha said housing stock in Springwood was tight, and with few properties currently on the market, buyer demand was expected to continue.

    ""I think such a small increase will not have a substantial impact on buying and selling activity,"" Ms Ojha said.

    Mortgage holders are likely feeling nervous this increase could be the first of a few, Ms Ojha said.

    But overall, she said she thought the rate hike would have little impact on the market.

    ""If rate rises continue and people have mortgages on more than one property, then they could be forced to sell,"" she said.

    ""But for others, 0.25% won't have a substantial impact, people will still try to hold on."""" For mortgage holders of around $600,000, re-payments will increase by $100 a month as a result of the rates hike, according to figures published in the Brisbane Times.

    All major banks, including the Commonwealth Bank of Australia. Westpac Banking Corporation, National Australia Bank, and Australia and New Zealand Banking Group Limited, have adjusted their interest rates to align with the Reserve Bank's rate rise.

    Ray White principal Avi Khan agrees rate rises are unlikely to cause any major shifts in Logan's property market.

    ""Rate cuts don't matter because it [Logan] is still the most affordable place for first home buyers and investors in the greater Brisbane area,"" Mr Khan said.

    ""And we're seeing strong entry-level demand from changes to state and federal government policy that is driving price growth even further.""","LOCAL real estate agents say the increase in mortgage repayment interest rates will have little to no effect on Logan's property market. The Reserve Bank of Australia raised interest rates by 0.25% on Tuesday 3 February, due to lingering economic inflation.",22,,,,,no,Not relevant,"The article discusses the impact of interest rate rises on the Logan property market from the perspective of local real estate agents. There is no mention of Logan City Council, its councillors, Mayor-elect Jon Raven, or any council-related activities, meetings, or policies.","None. The article contains no references to Logan City Council, councillors, or the mayor.",yes,Medium,"The article directly discusses house prices in the Logan region, which is explicitly included as part of the section criteria. The focus is on how interest rates affect the local property market, and it quotes local real estate agents on Logan's affordability and demand.","""LOCAL real estate agents say the increase in mortgage repayment interest rates will have little to no effect on Logan's property market."" ""Ray White principal Avi Khan agrees rate rises are unlikely to cause any major shifts in Logan's property market."" ""Rate cuts don't matter because it [Logan] is still the most affordable place for first home buyers and investors in the greater Brisbane area,"" Mr Khan said.","Local real estate agents, including LJ Hooker's Pragya Ojha and Ray White principal Avi Khan, assert that the Reserve Bank of Australia's recent 0.25% interest rate hike will have minimal impact on Logan's property market due to tight housing stock and strong buyer demand. Ojha notes that while mortgage holders of around $600,000 will see repayments increase by approximately $100 per month, a single small increase is unlikely to substantially affect market activity, though further rises could force some investors to sell. Khan emphasizes that Logan remains the most affordable area in greater Brisbane for first-home buyers and investors, with demand further bolstered by supportive state and federal government policies.",logan_property_market_interestrates,Logan Property Market Unaffected by Rate Hike,"Local real estate agents predict the Reserve Bank of Australia's recent 0.25% interest rate hike will have a minimal impact on Logan's property market. Agents from LJ Hooker and Ray White state that strong buyer demand and a tight housing supply will insulate the market from a single small increase. While mortgage repayments for a typical $600,000 loan will rise by about $100 per month, Logan is expected to remain the most affordable area in greater Brisbane. Demand from first-home buyers and investors, supported by government policies, is anticipated to stay strong.",logan_property_market_interestrates,Logan Property Market Unaffected by Rate Hike,"Local real estate agents predict the Reserve Bank of Australia's recent 0.25% interest rate hike will have a minimal impact on Logan's property market. Agents from LJ Hooker and Ray White state that strong buyer demand and a tight housing supply will insulate the market from a single small increase. While mortgage repayments for a typical $600,000 loan will rise by about $100 per month, Logan is expected to remain the most affordable area in greater Brisbane. Demand from first-home buyers and investors, supported by government policies, is anticipated to stay strong.",Lead,True,1170196948,9.0,0.587,OTHER NEWS,This print article's rank is primarily due to its media type. The score is moderated by its deep placement toward the back of the paper on page 22.,LOCAL real estate agents say the increase in mortgage repayment interest rates will have little to no effect on Logan's property market.
1305699866.0,R00129764409,ABC Radio Brisbane,AM Radio,"Interview
Lynne, who's clearly battling with the traffic, says, Steve, memo to Tom Sharp, it probably takes less time to fly to Rockhampton than to drive down the M1 to the scenic rim, says Lynne, wit",2026-02-10T08:45:22.000Z,606.0,QLD,Australia,"Interview
Lynne, who's clearly battling with the traffic, says, Steve, memo to Tom Sharp, it probably takes less time to fly to Rockhampton than to drive down the M1 to the scenic rim, says Lynne, with several exclamation marks. Lynne, thank you. On 6.12am. Streaming live on the ABC Listen app. 6.12, ABC Radio Brisbane. With Steve Austin. Just while on roads and some of the dramas that you're facing in a moment, as you've heard, the Waterford Tambourine Road Southern Logan has claimed four lives in three days. Transport Minister Brent Mickelberg spoke to our breakfast duo, Craig and Loretta, this morning, where they asked the Minister if the increase in accidents was driver behaviour or road conditions. This is the Transport Minister's reply. Well, the short answer, Craig, is it's both. And as I said, all of us who use the roads, and like most Queenslanders, I use the roads every single day, and I too see that sort of behaviour. I think what we need to do is we need to shift behaviours. Obviously, police will be out enforcing the laws, and our focus as a government is on ensuring that we free up the police so they're more able to be out and about enforcing with that proactive whether it's road safety or other community policing concerns. And we'll build the built infrastructure as well. Things like the Residential Activation Fund, $2 billion, that's all about addressing some of the concerns concerns that were just articulated by your corner. We call it building the infrastructure required to support the population growth that we are going to receive here in Queensland, whether we like it or not. We're going to see that population growth. People want to move to Queensland, so we need to build the infrastructure. And what we've seen is probably 10 years at least where we haven't had the infrastructure built to keep up with that population growth. Do we need, like, heavy rail through that Yarrabilba corridor, for instance? Well, absolutely. An investment in heavy rail is part of the solution. So it's why we're building Logan and Gold Coast Faster Rail. A massive investment in increasing the frequency and the reliability of rail to the Gold Coast.
Yeah, but people still need to get in their car from Yarrabilba to then get to one of those train stations.
Yeah, absolutely. And it's why we're also boosting boosting bus services. So recently we rolled out $70 million, which is to fund boosted bus services in exactly the kind of places we're talking about. And just last week or the week before, I think we talked about rolling out more bus services in Logan as well, in addition to the Ipswich area. So, you know, these issues are complex and they require a response that addresses both public transport, driver behaviour and built infrastructure in terms of the roads. But I guess the message to your listeners is it's incumbent on all of us it's not just of government, it's a job for every single road user to drive to the conditions and to get home safely. And ultimately, when I think about road safety, I think about the impact on on those who are left behind, the families who are left behind to pick up the pieces after these tragic incidents.
Transport Minister Brent Mickelberg, if you travel the Waterford-Tambourine Road, I would dearly love to know how you find it when you travel it, particularly if you do it every day in your commute. 1300 222 612 is the phone number. Or send a text 0467 922 612.","Interview
Lynne, who's clearly battling with the traffic, says, Steve, memo to Tom Sharp, it probably takes less time to fly to Rockhampton than to drive down the M1 to the scenic rim, says Lynne, with several exclamation marks. Lynne, thank you. On 6.12am. Streaming live on the ABC Listen app. 6.12, ABC Radio Brisbane. With Steve Austin. Just while on roads and some of the dramas that you're facing in a moment, as you've heard, the Waterford Tambourine Road Southern Logan has claimed four lives in three days. Transport Minister Brent Mickelberg spoke to our breakfast duo, Craig and Loretta, this morning, where they asked the Minister if the increase in accidents was driver behaviour or road conditions. This is the Transport Minister's reply. Well, the short answer, Craig, is it's both. And as I said, all of us who use the roads, and like most Queenslanders, I use the roads every single day, and I too see that sort of behaviour. I think what we need to do is we need to shift behaviours. Obviously, police will be out enforcing the laws, and our focus as a government is on ensuring that we free up the police so they're more able to be out and about enforcing with that proactive whether it's road safety or other community policing concerns. And we'll build the built infrastructure as well. Things like the Residential Activation Fund, $2 billion, that's all about addressing some of the concerns concerns that were just articulated by your corner. We call it building the infrastructure required to support the population growth that we are going to receive here in Queensland, whether we like it or not. We're going to see that population growth. People want to move to Queensland, so we need to build the infrastructure. And what we've seen is probably 10 years at least where we haven't had the infrastructure built to keep up with that population growth. Do we need, like, heavy rail through that Yarrabilba corridor, for instance? Well, absolutely. An investment in heavy rail is part of the solution. So it's why we're building Logan and Gold Coast Faster Rail. A massive investment in increasing the frequency and the reliability of rail to the Gold Coast.
Yeah, but people still need to get in their car from Yarrabilba to then get to one of those train stations.
Yeah, absolutely. And it's why we're also boosting boosting bus services. So recently we rolled out $70 million, which is to fund boosted bus services in exactly the kind of places we're talking about. And just last week or the week before, I think we talked about rolling out more bus services in Logan as well, in addition to the Ipswich area. So, you know, these issues are complex and they require a response that addresses both public transport, driver behaviour and built infrastructure in terms of the roads. But I guess the message to your listeners is it's incumbent on all of us it's not just of government, it's a job for every single road user to drive to the conditions and to get home safely. And ultimately, when I think about road safety, I think about the impact on on those who are left behind, the families who are left behind to pick up the pieces after these tragic incidents.
Transport Minister Brent Mickelberg, if you travel the Waterford-Tambourine Road, I would dearly love to know how you find it when you travel it, particularly if you do it every day in your commute. 1300 222 612 is the phone number. Or send a text 0467 922 612.",0,,434881.0,Suburbs - Broadcast,2026-02-10 08:45:22,no,Low,"The article is a traffic and road safety discussion with the Queensland Transport Minister. It mentions the Logan area in the context of accidents and transport infrastructure, but there is no mention of Logan City Council, any Logan councillors (including Mayor-elect Jon Raven), or any council-specific actions, publications (like MyCityLogan), or decisions.","""the Waterford Tambourine Road Southern Logan has claimed four lives in three days"" and ""we talked about rolling out more bus services in Logan as well""",yes,High,"The article is an interview with the Transport Minister focused on road safety, driver behaviour, and infrastructure issues in the Logan region, specifically mentioning Waterford Tambourine Road and discussing public transport investments in Logan.","""the Waterford Tambourine Road Southern Logan has claimed four lives in three days... These issues are complex and they require a response that addresses both public transport, driver behaviour and built infrastructure in terms of the roads.""","Transport Minister Brent Mickelberg attributed recent fatal crashes on Waterford Tamborine Road in Southern Logan to a combination of driver behaviour and inadequate road infrastructure. Acknowledging long-term underinvestment, he outlined the Queensland Government's response, including a $2 billion Residential Activation Fund for infrastructure, Logan and Gold Coast Faster Rail projects, and $70 million for boosted bus services in Logan and Ipswich areas. Minister Mickelberg emphasized that improving road safety is a shared responsibility between the government, involving police enforcement and infrastructure upgrades, and all road users.",logan_crash_yarrabilba,Triple-Fatal Yarrabilba Crash Sparks Road Safety Debate,"A devastating head-on collision on Waterford Tamborine Road in Yarrabilba claimed three lives: Jessica Ortiz (33), her father-in-law Jorge Ortiz (65), and teenager Izayiah Aitken (18). Several other family members, including Jessica's two-year-old daughter, were seriously injured. In response to recent fatal crashes in the area, Transport Minister Brent Mickelberg acknowledged long-term underinvestment in road infrastructure and driver behaviour as contributing factors. The Queensland Government has outlined several major infrastructure projects, including a $2 billion Residential Activation Fund and faster rail for Logan, to address the issues. Police are investigating the crash and have appealed for dashcam footage.",,,,Lead,True,R00129764409,10.0,0.555,OTHER NEWS,This broadcast piece ranks below print due to media type priority. Its high score within its category is due to the Tier 1 outlet (ABC Radio) and high relevance to Logan infrastructure.,"Just while on roads and some of the dramas that you're facing in a moment, as you've heard, the Waterford Tambourine Road Southern Logan has claimed four lives in three days."
